"gate_id","gate_name","sprint","gate_type","criteria","responsible_team","gate_date","approval_required","approver","bypass_criteria","automation_level","tools_used","success_metrics"
"QG-001","Sprint 1 Quality Gate: Backend Foundation","Sprint 1","Security,Performance,Code Quality","Performance benchmark test (TASK-DTE-005) must pass. All Jint sandbox constraint tests must pass. Code coverage for security-related code > 90%. Successful security review of DPAPI implementation.","QA Team, Security Architect","2024-06-20","true","tech.lead@company.com","Not bypassable.","Fully Automated","xUnit, SonarQube","Zero critical security findings. Performance target met."
"QG-002","Sprint 2 Quality Gate: Core UI/API","Sprint 2","Testing,Integration","E2E tests for script editor and preview functionality must pass. All API endpoints must be documented in OpenAPI. No critical accessibility issues found in UI components.","QA Team, Frontend Team","2024-07-04","true","product.owner@company.com","None.","Partially Automated","Cypress, Axe, Swagger","Core admin user flow is functional and intuitive."
"QG-003","Sprint 3 Quality Gate: Compliance & Change Management","Sprint 3","Security,Compliance","Successful security review of the audit log immutability design. Integration tests for transactional integrity of versioning logic must pass. All specified events are logged to the audit trail.","Security Architect, QA Team","2024-07-18","true","compliance.officer@company.com","Not bypassable for compliance-related items.","Partially Automated","xUnit, Manual Review","Audit trail design is approved for SOC 2 / ISO 27001 objectives."
"QG-004","Sprint 4 Quality Gate: Feature Enhancement","Sprint 4","Integration,Testing","E2E tests for UI versioning features (diff, revert) must pass. Prometheus metrics are correctly generated and scraped. Data size and schema validation rules are successfully enforced in integration tests.","QA Team","2024-08-01","true","tech.lead@company.com","None.","Fully Automated","Cypress, xUnit, Prometheus","All new features are functional and meet acceptance criteria."
"QG-005","Sprint 5 Quality Gate: Release Readiness","Sprint 5","Documentation,Operational Readiness","All user-facing documentation is complete and reviewed. Migration script is tested and documented. Feature flag functionality is verified end-to-end. Final regression testing is complete.","QA Team, DevOps Lead","2024-08-15","true","product.owner@company.com","None.","Partially Automated","Manual Review, E2E Test Suite","Feature is ready for a controlled production release."