"role","primary_skills","experience_level","capacity_hours_per_sprint","productivity_factor","effective_capacity","tasks_assigned","total_allocated_hours","utilization_percentage","buffer_hours","mentoring_capacity","code_review_hours","cross_training_hours","availability_constraints","skill_development_goals","backup_resources","risk_mitigation","cost_per_hour","total_cost","alternative_allocation"
"Senior Backend Developer","C#,Jint,Security,.NET Data Protection","Senior","64","1.2","76.8","[""REQ-FUNC-DTR-001"",""REQ-SEC-DTR-001"",""REQ-SEC-DTR-003"",""REQ-INTG-DTR-001"",""REQ-FUNC-DTR-002"",""REQ-PERF-DTR-001"",""REQ-DATA-DTR-001"",""REQ-BR-DTR-001"",""REQ-SEC-DTR-002"",""REQ-COMP-DTR-001"",""REQ-REL-DTR-001""]","40","62.5","24","10","6.4","4","Available full-time","Master Jint security sandboxing.","backend.dev2@company.com","Key person dependency for core engine. Pair programming on security features is critical.","90","5760","Can absorb an additional medium-complexity task if needed."
"Backend Developer","C#,ASP.NET Core,EF Core,Prometheus","Mid","64","1","64","[""REQ-FUNC-DTR-004"",""REQ-SEC-DTR-004"",""REQ-FUNC-DTR-003"",""REQ-FUNC-DTR-006"",""REQ-OPER-DTR-001""]","28","43.75","36","","6.4","8","Available full-time","Gain experience in security (RBAC) and monitoring (Prometheus).","backend.dev1@company.com","Mentored by senior dev on security tasks.","70","4480","Has capacity for additional API or integration tasks."
"Frontend Developer","React,TypeScript,Monaco Editor,CSS","Mid","64","1","64","[""REQ-UI-DTR-002"",""REQ-UI-DTR-003"",""REQ-UI-DTR-001""]","28","43.75","36","","6.4","4","Available full-time","Deep integration of Monaco Editor and complex UI layouts.","fullstack.dev1@company.com","High risk on Monaco integration; requires a PoC spike.","75","4800","Can assist with other React-based UI tasks if script editor is delayed."
"Fullstack Developer","C#,React,TypeScript,EF Core","Senior","64","1.1","70.4","[""REQ-FUNC-DTR-005"",""REQ-OPER-IMP-001""]","24","37.5","40","8","6.4","4","Available full-time starting Sprint 3.","Lead implementation of complex full-stack features like versioning.","backend.dev1@company.com,frontend.dev1@company.com","Serves as a backup for both frontend and backend critical paths.","85","5440","Flexible resource to be deployed on either frontend or backend bottlenecks."
"QA Engineer","Performance Testing,E2E Testing,C#,xUnit","Mid","64","1","64","[""REQ-PERF-DTR-002""]","12","18.75","52","","","4","Allocated across multiple projects. This represents their capacity for this project.","Automate performance benchmark tests into CI/CD pipeline.","N/A","Engage with DevOps early to set up performance testing environment.","65","4160","Can increase testing capacity as development sprints produce testable features."
"DevOps Engineer","DevOps,Technical Writing,CI/CD","Senior","64","1.2","76.8","[""REQ-OPER-IMP-004""]","8","12.5","56","4","2","","Shared resource, allocated as needed. Sprint 5 allocation shown.","Document and automate rollback procedures.","N/A","Involve early in discussions about deployment and monitoring.","85","5440","Available for CI/CD pipeline adjustments and performance environment setup."